Task Name,Task Description,Deliverables
Introduction to the Company and Team,"Hello,

I am Kevin Rush, the CEO of AI Minds; I want to welcome you and thank you for joining our team. You are an integral part of our company, and we are excited to have you on board as we work together to deliver innovative AI solutions to our clients.

We understand that you are here to learn, and we are committed to providing you with valuable experiences and opportunities to build your skills and knowledge. Our goal is to create a supportive and collaborative environment where you can develop your technical skills, gain hands-on experience, and contribute to developing cutting-edge AI solutions. 

Our mission as an AI consulting company is to empower businesses with AI solutions so they can transform how they operate, innovate, and grow. In addition, we strive to deliver customized AI solutions tailored to our client's needs.

Our vision is to be a leading provider of AI consulting services globally, recognized for our innovative and customer-centric approach. We aim to be at the forefront of AI innovation, helping businesses leverage the power of AI to transform their operations and achieve their business goals.

At AI Minds, we have a core set of values listed below.
Customer-Centric: We put our client's needs at the center of everything we do and strive to deliver exceptional customer experiences at every touchpoint.
Innovation: We are committed to exploring new technologies and approaches to problem-solving, and we encourage creativity and out-of-the-box thinking.
Accountability: We take ownership of our work and hold ourselves accountable for delivering high-quality, timely, cost-effective solutions.
Learning: We believe in continuous learning and development. We encourage our team members to take on new challenges and face the unknown to acquire new skills and knowledge to become true experts.
Growth Mindset: This is crucial as our projects tend to be multidisciplinary, with a steep learning curve.

AI consulting is a growing industry that helps businesses harness the power of artificial intelligence to drive growth, streamline operations, and improve customer experience. AI consulting firms work with various clients, including small startups, mid-sized companies, and large enterprises. These clients come from diverse industries, including automotive, finance, retail, e-commerce, and more. AI consulting firms provide various services, including strategic planning, data analysis, software development, and implementation of AI solutions. The services provided by AI consulting firms can also vary widely, depending on the client's needs. For example, some clients may require help with data analysis and modeling, while others may need assistance with developing AI-driven software solutions. AI consulting firms can also provide guidance on ethical and legal considerations related to AI technologies, such as data privacy, bias, and security. In addition, they work with clients to identify areas where AI can be applied to improve operations, enhance customer experiences, and increase profitability. 
As an intern at our company, you will be exposed to many projects requiring creativity, resilience, and resourcefulness to design and implement AI solutions for clients. In addition, as an intern at AI Minds, you will be an integral part of the team responsible for developing and implementing AI solutions for clients. Your roles and responsibilities include the following:

Research and Analysis: You will be responsible for conducting research and analysis on various AI-related topics, such as new technologies, trends, and best practices. This research will inform the development of AI solutions for clients.
Data Collection, Preparation, and Cleaning: You will collect, prepare, and clean data for AI models. This includes tasks such as data entry, formatting, and imputation.
Model Development: You will develop and refine AI models that can be used to address specific client needs. This may involve feature selection, model training, and model evaluation.
Testing and Validation: You will be responsible for testing and validating AI models to ensure they work as intended. This may involve testing model performance, validating model accuracy, and conducting stress tests.
Documentation: You will document your work, including data analysis, model development, and project management. This documentation will need to be clear, concise, and well-organized to ensure that other team members can easily understand and replicate your work.
Communication: You must communicate effectively with the supervisor and clients through emails and reports. 

Overall, you will be expected to be a proactive team player eager to learn and contribute to the success of the firm's projects. You must be flexible, adaptable, and willing to take on new challenges as they arise. By doing so, you will gain valuable experience in the field of AI consulting and develop the skills and knowledge needed to become a successful AI consultant.

But you will not be alone. You will have a supervisor responsible for overseeing your work and providing guidance and support throughout your internship. Your supervisor will be a faculty member of the educational institution you are currently enrolled in. They will always be available to support you while you are working with us.

Our customers come from various industries and have commissioned us to advise them and aid them to work effectively with AI. Our clients come to us with a range of familiarity with AI, ranging from complete beginners to experts. Therefore, it is our responsibility to ensure we help them achieve the technical capabilities they desire and educate them so that when our contract ends, they have a deep understanding of the work we have done and are prepared to continue with their projects. You can communicate openly with the customer on our work portal (the website you are currently on). You will also see their name denoted with the customer tags in the messaging section of the projects. We will discuss messaging best practices on the third day of your training.","As a first assignment, I'd like you to write a report detailing your role in our team in your own words. Please also include what you hope to get from this internship experience.
 
Additionally, for us to get a better sense of who you are and what experience you will be bringing into this role, I'd like you to answer the following questions:
Of the latest developments in AI, which interest you the most, and how could they be applied to solve real-world problems?
What do you think are the most significant challenges facing organizations looking to implement AI technologies, and how can these challenges be addressed?
What inspired you to pursue a career in AI, and what are your career goals?
What experience do you have with data analysis and modeling, and how could these skills be applied to support AI consulting projects?
How do you plan to apply the knowledge gained from this internship in your future career?

As a final note, please do not hesitate to share any questions or comments on this onboarding task, the company, the team, or any other subject. "
